{
  "mode": "general",
  "purpose": "異世界転生トロープの語彙で現実の制度(労働・格差・課金設計・アルゴリズム)の建前を読み上げさせ、怒りを聞きやすいデッドパンの笑いに変換する。笑いは逃避ではなく、モブ配役を拒否する最終宣言(core_message)への助走として機能させる。",
  "target_policy": {
    "allowed": [
      "労働制度の建前(求人広告の美辞、残業の常態化、やりがい搾取の言説)",
      "格差の構造(初期条件の配布=親ガチャという制度的偶然、無資本の再生産)",
      "課金設計そのもの(排出率・天井・サンクコストを利用する設計思想)",
      "レコメンドアルゴリズムと注目経済(誰を主人公にするかを決める配信構造)",
      "語り手自身の願望と自己欺瞞(転生に賭けてきた自分への自嘲)"
    ],
    "avoided": [
      "困窮している個人・非正規労働者本人(語り手の仲間側)への punch-down",
      "特定の実在企業・実在作品・実在人物(固有名を一切出さない)",
      "オタク趣味・アニメ視聴者という属性そのものの嘲笑",
      "親個人への攻撃(標的は『配布の仕組み』であり親ではない)",
      "病気・障害・容姿など変更不能な属性"
    ]
  },
  "density_map": [
    {"section_id": "hook1", "bars": 8, "max_punches": 1, "note": "反復フックの軸となる両義語1つのみ。笑いより刷り込み優先"},
    {"section_id": "verse1", "bars": 16, "max_punches": 3, "note": "4小節に1つ上限。HD03の仕込みはパンチとして数えず平文で置く"},
    {"section_id": "hook2", "bars": 8, "max_punches": 1, "note": "hook1と同型+1語差し替えで意味を反転させる"},
    {"section_id": "verse2", "bars": 16, "max_punches": 3, "note": "強いパンチ(HD06)の直後4小節は平文で回収余白を残す"},
    {"section_id": "hook3_outro", "bars": 8, "max_punches": 2, "note": "HD03コールバック回収+HD08アンチクライマックス宣言。以降は笑い無しで終える"}
  ],
  "punch_cards": [
    {
      "id": "HD01",
      "humor_id": "HD01",
      "technique": "double_meaning",
      "type": "double_meaning",
      "section_id": "hook1",
      "prediction": "『今日も周回』という語で、聞き手はまずアニメ・ゲームの周回(好きな作品の見返し・レベル上げ)の話だと読む",
      "violation": "周回の対象が作品ではなく、同じ環状の通勤路線・同じシフト・同じ深夜コンビニの棚だと分かる",
      "reframe": "『周回プレイ』は趣味ではなく労働のルーティンの正式名称だった。楽しみの語彙が労役の語彙と同じ形をしている",
      "benignizer": "語り手自身も周回している当事者であり、笑いの矛先は反復を強いる勤務構造に向く(上向き批評+自虐)",
      "target": "ルーティン労働の構造",
      "setup": {
        "stated_fact": "フック冒頭で『周回』を目的語なしで反復する(何を周回しているかは言わない)",
        "predicted_frame": "ゲーム/アニメ趣味の快楽的な繰り返しの話"
      },
      "turn": {
        "violated_expectation": "快楽の反復だと思わせた語が、賃労働の強制反復を指していた",
        "bridge_for_legibility": "周回の目的語を後出しする(路線名ではなく『同じ駅』『同じ棚』級の一般具体物で明示)。両義が音だけで伝わるよう、趣味側の読みを支える語をフック前半に1つ置く"
      },
      "landing": {
        "semantic_target": "目的語となる現実側の具体物1語",
        "timing": "フック4小節目の頭拍。目的語の直前に1/8休符。声色はフラットのまま変えない(内容の落差だけで運ぶ)"
      },
      "character_cost": "語り手は自分の生活が『好きで回している周回』ではないと認めることになる",
      "risk": "両義が画面表記依存にならないよう音声のみで一次解釈が成立するかの確認が必要。obscurity: low / cruelty: low",
      "timing": {"placement": "hook1 bar4 頭拍", "pre_punch_rest_beats": 0.5, "voice": "deadpan", "after_punch_explanation": false},
      "meaning_without_joke": "娯楽の語彙と労働の実態が同じ構造を持つという観察。笑いを外しても『反復される生活』の描写として立つ"
    },
    {
      "id": "HD02",
      "humor_id": "HD02",
      "technique": "register_collision",
      "type": "register_collision",
      "section_id": "verse1",
      "prediction": "『ステータスオープン』的な決まり文句で、聞き手はチート級の能力値・スキル一覧の開示を予測する",
      "violation": "読み上げられる項目が奨学金の残高・時給・今月の残業時間・可処分の残りという現実の数値",
      "reframe": "ステータス画面は最初から存在していた。給与明細と残高通知こそが、この世界で配布済みの公式UIだった",
      "benignizer": "数値は語り手自身のもの(自虐)であり、笑いの標的は数値を配布した賃金・奨学金の制度設計に向く",
      "target": "賃金水準と教育費負債の制度",
      "setup": {
        "stated_fact": "RPGのメニュー呼び出しの構文(命令形の掛け声→項目の列挙)をそのまま使う",
        "predicted_frame": "異世界主人公の規格外ステータス開示",
      "withheld": "列挙される項目のカテゴリが現実の家計であること"
      },
      "turn": {
        "violated_expectation": "ファンタジーの数値開示が家計簿の読み上げにすり替わる",
        "bridge_for_legibility": "列挙の1項目目はゲームでも家計でも通る語(例: 所持金に相当する一般語)にして橋を架け、2項目目以降で現実側に確定させる"
      },
      "landing": {
        "semantic_target": "列挙の2項目目(現実側に確定する最初の数値)",
        "timing": "三連の列挙で1項目目は両義、2項目目で確定、3項目目で最も生々しい数値。3項目目の前に1/4休符"
      },
      "character_cost": "誇張された自己紹介の裏で、実数値の低さを自分の口で公開する羞恥",
      "risk": "数値の羅列が説教臭くならないよう、正論の読み上げで終わらせず具体物で締める必要。stereotype: low / cruelty: low",
      "timing": {"placement": "verse1 前半4小節ブロックの3〜4小節目", "list_structure": "三段: 両義→確定→最も具体", "pre_punch_rest_beats": 0.25, "voice": "ステータス読み上げの機械的な平板さ"},
      "meaning_without_joke": "若年労働者の初期条件(負債と低賃金)が『配布済みの数値』として固定されているという告発"
    },
    {
      "id": "HD03",
      "humor_id": "HD03",
      "technique": "setup_payoff",
      "type": "setup_payoff",
      "section_id": "verse1",
      "prediction": "深夜、道路脇、近づくヘッドライト──トロープ知識のある聞き手は『トラック=転生イベントの引き金』を予測する",
      "violation": "トラックは止まり、荷を降ろし始める。それは語り手が深夜バイトで検品する配送便であり、転生装置ではなく物流だった",
      "reframe": "この世界でトラックが運ぶのは異世界行きの魂ではなく段ボール。転生の象徴すら労働のインフラとして再雇用されている",
      "benignizer": "架空トロープの構造いじりであり、実在の事故・被害者を想起させる描写(衝突・負傷)は一切描かない。トラックは『止まって荷を降ろす』だけ",
      "violence_note": "轢かれる場面を書かないこと。期待だけを借りて、車両は静かに業務を始める",
      "target": "現実逃避の願望と、それを許さない労働の遍在",
      "setup": {
        "stated_fact": "verse1中盤、深夜の路上でヘッドライトが近づく情景を1〜2小節、無説明で置く(パンチとして数えない平文の仕込み)",
        "predicted_frame": "お約束の転生イベントが始まる"
      },
      "turn": {
        "violated_expectation": "物語の起動装置だと思われた車両が、ただの夜間シフトの始まりを告げる",
        "bridge_for_legibility": "トロープ側の読みを支えるため、直前に『ここで人生が変わるはず』級の願望の独白を最小語数で置く"
      },
      "landing": {
        "semantic_target": "車両が始める業務動作(荷降ろし・検品)を示す1語",
        "timing": "ヘッドライト描写の後に丸1拍の休符→業務動作の語を単独で置く。期待の間を最大化する"
      },
      "character_cost": "転生を待っていた自分の受け身さを直視する。待つ側から書く側へ転回する動機がここで生まれる",
      "risk": "トロープを知らない聞き手には仕込みが読めない可能性→願望の独白で二重に支える。obscurity: medium",
      "timing": {"placement": "verse1 bar9-12(仕込みbar9-10、回収bar11)", "pre_punch_rest_beats": 1.0, "voice": "期待で少し上ずる→業務語で平板に落とす", "callback_id": "CB1"},
      "meaning_without_joke": "救済イベントは来ない、来るのは仕事だけ、という主題の最初の提示"
    },
    {
      "id": "HD04",
      "humor_id": "HD04",
      "technique": "satire",
      "type": "satire",
      "section_id": "verse1",
      "prediction": "『ガチャ』の語で、聞き手はスマホゲームの課金演出(排出率、確率表記、天井)の話だと読む",
      "violation": "説明されているガチャは出生時の初期ステータス配布──いわゆる親ガチャ──であり、しかも『提供割合は非公開、引き直し不可、天井なし』と課金ガチャ以下の設計だと事務的に告知される",
      "reframe": "課金ガチャには消費者保護の建前(確率表記・天井)が一応あるのに、人生の初期配布にはそれすらない。ゲームの方が現実よりまだ誠実な設計だった",
      "benignizer": "標的は配布の『設計』と格差の構造であり、親個人でも引きの悪かった本人でもない。運営告知の口調(架空の運営)というフィクションの膜を張る",
      "target": "格差の再生産構造と、確率で射幸心を回収する課金設計の思想",
      "setup": {
        "stated_fact": "ソシャゲの利用規約・お知らせ文の丁寧なレジスター(『平素より…』級の定型)で開始する",
        "predicted_frame": "ゲーム内の新ガチャ告知のパロディ"
      },
      "turn": {
        "violated_expectation": "告知対象のガチャがゲームではなく出生条件の配布システムだった",
        "bridge_for_legibility": "『引き直し不可』『天井なし』という課金用語を現実側の含意(生まれ直せない、救済ラインがない)が一意に立つ順で並べる"
      },
      "landing": {
        "semantic_target": "『天井なし』相当の一句(救済保証の不在)",
        "timing": "告知文体を2小節維持してから最後の条項として置く。声はお知らせ口調のまま最後まで崩さない(デッドパン併用)"
      },
      "character_cost": "語り手も引き直せない側として話しており、被害者ぶりではなく設計への批評として立つ必要がある",
      "risk": "『親ガチャ』語の既視感が高い→既存の嘆き節をなぞらず、消費者保護との比較という新しい角度に限定する。familiarity: medium",
      "timing": {"placement": "verse1 後半4小節ブロック", "voice": "運営告知の慇懃な丁寧語", "pre_punch_rest_beats": 0.5, "after_punch_explanation": false},
      "meaning_without_joke": "出生の偶然が人生の初期条件を決め、そこに救済設計が存在しないという構造批評"
    },
    {
      "id": "HD05",
      "humor_id": "HD05",
      "technique": "double_meaning",
      "type": "double_meaning",
      "section_id": "hook2",
      "prediction": "hook1と同型のフレーズが返ってくるので、聞き手は同じ意味の反復を予測する(反復による規則の確立)",
      "violation": "1語だけ差し替わり、『主人公補正』が実力でも運命でもなく、おすすめ欄のアルゴリズムが可視性を配る仕組みの別名だと示す",
      "reframe": "誰が主人公に見えるかは物語ではなく配信面の設計が決めている。モブとは才能の欠如ではなく、レコメンドに拾われない側の座席名",
      "benignizer": "標的は注目を配分するプラットフォーム設計。拾われない個人(語り手含む)を笑わない",
      "target": "レコメンドアルゴリズムと注目経済",
      "setup": {
        "stated_fact": "hook1の譜割りと語順を保存したまま、核となる1語のみ差し替える(反復2回で規則→3回目の変化)",
        "predicted_frame": "hook1と同じ意味の心地よい反復"
      },
      "turn": {
        "violated_expectation": "同じ器に載った1語の交換で、フック全体の意味が趣味/労働から可視性の配分へスライドする",
        "bridge_for_legibility": "差し替え語は『補正』『おすすめ』級の、アニメ文脈とフィード文脈の両方で既出の語に限定する"
      },
      "landing": {
        "semantic_target": "差し替えられた1語そのもの",
        "timing": "hook1と同一グリッドに置く(休符も同じ)。変化に気づく快感を譜割りの同一性で支える。声色も同一"
      },
      "character_cost": "語り手は自分の無名性を『実力不足』ではなく『配分の結果』と言い直す──言い訳と紙一重の危うさを引き受ける",
      "risk": "hook1が十分刷り込まれていないと差分に気づかれない→統合側でhook1の反復回数を確保すること。dependency: high",
      "timing": {"placement": "hook2 bar4(hook1のパンチ語と同座標)", "voice": "hook1と同一", "structural_rule": "二度の同型+三度目の一語変化"},
      "meaning_without_joke": "可視性がアルゴリズムに配分される時代の『主人公/モブ』の再定義"
    },
    {
      "id": "HD06",
      "humor_id": "HD06",
      "technique": "bathos",
      "type": "bathos",
      "section_id": "verse2",
      "prediction": "スキルツリー・レベルアップの語彙で経験値が溜まっていく描写が続き、聞き手はチート能力の覚醒か劇的な成り上がりを予測する",
      "violation": "覚醒の瞬間に開示されるのは、深夜勤務で磨かれた極小の熟練(レジ打ちの速度、棚の配置の暗記、クレームの受け流し)と、それに対する数十円単位の昇給",
      "reframe": "経験値は本当に溜まっていた──ただし換金レートが壊れている。スキルが安いのではなく、値付けの仕組みが技能を安く買い叩いている",
      "benignizer": "熟練そのものは本物として敬意を持って描く(技能の嘲笑ではない)。笑いの落差は評価制度・賃金テーブルに向く",
      "target": "技能を低く値付けする賃金制度",
      "setup": {
        "stated_fact": "3〜4小節かけてレベルアップの高揚を本気で積む(誇張の上り坂。ここは茶化さない)",
        "predicted_frame": "ついに主人公化する転換点"
      },
      "turn": {
        "violated_expectation": "英雄的覚醒の頂点で、開示される報酬が桁違いに小さい",
        "bridge_for_legibility": "落差の後に『でも腕は本物』の一拍を残し、技能否定ではなく値付け批判だと一意に読めるようにする"
      },
      "landing": {
        "semantic_target": "昇給額など極小の具体的数値1つ",
        "timing": "上り坂はフロー密度を上げ、数値の直前でビートの引き算(統合側へ提案)+半拍休符。数値は小声・短い語尾で置き、直後に説明を足さない"
      },
      "character_cost": "積み上げた熟練を誇りたい気持ちと、その市場価値の低さを同時に認める痛み",
      "risk": "自虐が自己嫌悪に落ちる危険→直後の平文小節で『観察の鋭さ』か『次の行動』を必ず残す。cruelty(対自分): medium→要緩和",
      "timing": {"placement": "verse2 前半4〜8小節目。パンチ後4小節は平文", "pre_punch_rest_beats": 0.5, "voice": "誇張クレッシェンド→数値だけ小声", "beat_suggestion": "数値の小節でドラム引き算(proposal)"},
      "meaning_without_joke": "熟練は蓄積するのに賃金に反映されないという労働価値の断層"
    },
    {
      "id": "HD07",
      "humor_id": "HD07",
      "technique": "deadpan",
      "type": "deadpan",
      "section_id": "verse2",
      "prediction": "ギルドの受付・クエスト受注の場面立てで、聞き手は冒険の依頼(討伐・報酬・ランク査定)の定型を予測する",
      "violation": "受付の丁寧語が読み上げる依頼内容は求人票と辞令の文言──『アットホームな職場です』『報酬: やりがい』『本日の強制クエスト: サービス残業』──であり、冒険の語彙と雇用の語彙が完全に一致してしまう",
      "reframe": "ギルドとは人材業と労務管理の異世界コスプレだった。断れないクエストの正式名称は業務命令という",
      "benignizer": "標的は求人広告の美辞と残業を常態化させる労務慣行。窓口で働く受付個人を笑わない(受付も同じ制度の中の労働者として描く)",
      "target": "求人言説の建前と残業の常態化",
      "setup": {
        "stated_fact": "受付の敬語レジスターを確立してから依頼条項を列挙する(三段: 冒険側で通る条項→両義の条項→雇用側でしか通らない条項)",